{
  "version": "0.3.0",
  "generated": "2026-08-09T12:00:00",
  "source_fetch": "newvelles/latest_news.json (backend repo sample, QA feed set)",
  "feeds": 12,
  "article_count": 127,
  "story_count": 41,
  "merge_threshold": 0.5,
  "stories": [
    {
      "id": "st_11f911",
      "headline": "Google researchers depart as the Pixel 11 event approaches",
      "headline_source": "llm",
      "keywords": [
        "google 2026",
        "expect",
        "pixel"
      ],
      "entities": [
        "Google",
        "Expect"
      ],
      "section": "Tech",
      "outlet_count": 2,
      "article_count": 6,
      "latest_published": "2026-08-07T12:00:00Z",
      "merged_from_groups": 1,
      "outlets": [
        {
          "outlet": "Lifehacker",
          "domain": "lifehacker.com",
          "articles": 4
        },
        {
          "outlet": "NYT",
          "domain": "nytimes.com",
          "articles": 2
        }
      ],
      "articles": [
        {
          "title": "How to Watch Made by Google 2026: The Pixel Event's Start Time and What to Expect",
          "link": "https://lifehacker.com/tech/how-to-watch-made-by-google-2026-pixel-event-start-time-livestream?utm_medium=RSS",
          "published": "2026-08-07T12:00:00Z",
          "outlet": "Lifehacker",
          "domain": "lifehacker.com",
          "section": "Tech",
          "feed": "https://lifehacker.com/feed/rss"
        },
        {
          "title": "Made by Google 2026: What to Expect From the Pixel 11 Event",
          "link": "https://lifehacker.com/tech/what-to-expect-made-by-google-pixel-11-event-2026?utm_medium=RSS",
          "published": "2026-08-06T14:00:00Z",
          "outlet": "Lifehacker",
          "domain": "lifehacker.com",
          "section": "Tech",
          "feed": "https://lifehacker.com/feed/rss"
        },
        {
          "title": "Four Top Google A.I. Researchers Form New Start-Up",
          "link": "https://www.nytimes.com/2026/08/05/technology/google-researchers-ai-startup.html",
          "published": "2026-08-05T16:00:07Z",
          "outlet": "NYT",
          "domain": "nytimes.com",
          "section": "Tech",
          "feed": "https://rss.nytimes.com/services/xml/rss/nyt/Technology.xml"
        },
        {
          "title": "Google Never Should Have Put Nano Banana Into Google Earth in the First Place",
          "link": "https://lifehacker.com/tech/google-never-should-have-put-nano-banana-into-google-earth-in-the-first?utm_medium=RSS",
          "published": "2026-08-03T20:00:00Z",
          "outlet": "Lifehacker",
          "domain": "lifehacker.com",
          "section": "Tech",
          "feed": "https://lifehacker.com/feed/rss"
        },
        {
          "title": "This Unlocked Google Pixel 10a Is Now $75 Off",
          "link": "https://lifehacker.com/tech/pixel-10a-deal-august-2026?utm_medium=RSS",
          "published": "2026-08-03T19:30:00Z",
          "outlet": "Lifehacker",
          "domain": "lifehacker.com",
          "section": "Tech",
          "feed": "https://lifehacker.com/feed/rss"
        },
        {
          "title": "Google Earth Disables A.I. Tool After One Day Over Disinformation Concerns",
          "link": "https://www.nytimes.com/2026/08/02/technology/google-earth-ai-satellite-images.html",
          "published": "2026-08-03T14:31:11Z",
          "outlet": "NYT",
          "domain": "nytimes.com",
          "section": "Tech",
          "feed": "https://rss.nytimes.com/services/xml/rss/nyt/Technology.xml"
        }
      ],
      "days_running": 4,
      "first_seen": "2026-08-03",
      "kind": "story"
    },
    {
      "id": "st_23d9a0",
      "headline": "This 45-Inch LG UltraGear OLED Curved Gaming Monitor Is $700 Off Right Now",
      "headline_source": "fallback",
      "keywords": [
        "oled gaming monitor",
        "lg",
        "27-"
      ],
      "entities": [],
      "section": "Tech",
      "outlet_count": 2,
      "article_count": 6,
      "latest_published": "2026-08-08T11:01:00Z",
      "merged_from_groups": 1,
      "outlets": [
        {
          "outlet": "Lifehacker",
          "domain": "lifehacker.com",
          "articles": 5
        },
        {
          "outlet": "WIRED",
          "domain": "wired.com",
          "articles": 1
        }
      ],
      "articles": [
        {
          "title": "Best Gaming Laptops (2026): Razer, Asus, Dell, and More",
          "link": "https://www.wired.com/story/best-gaming-laptops/",
          "published": "2026-08-08T11:01:00Z",
          "outlet": "WIRED",
          "domain": "wired.com",
          "section": "Tech",
          "feed": "https://www.wired.com/feed"
        },
        {
          "title": "This LG Ultrawide OLED Gaming Monitor Is $200 Off Right Now",
          "link": "https://lifehacker.com/tech/lg-evo-ultragear-gaming-monitor-sale-august-2026?utm_medium=RSS",
          "published": "2026-08-07T12:30:00Z",
          "outlet": "Lifehacker",
          "domain": "lifehacker.com",
          "section": "Tech",
          "feed": "https://lifehacker.com/feed/rss"
        },
        {
          "title": "This 27-Inch Asus OLED Gaming Monitor Is $120 Off Right Now",
          "link": "https://lifehacker.com/tech/asus-oled-gaming-monitor-deal-august-2026?utm_medium=RSS",
          "published": "2026-08-06T18:00:00Z",
          "outlet": "Lifehacker",
          "domain": "lifehacker.com",
          "section": "Tech",
          "feed": "https://lifehacker.com/feed/rss"
        },
        {
          "title": "This 15.6-Inch Dell Laptop Is $130 Off Right Now",
          "link": "https://lifehacker.com/tech/dell-156-laptop-deal-august-2026?utm_medium=RSS",
          "published": "2026-08-05T18:00:00Z",
          "outlet": "Lifehacker",
          "domain": "lifehacker.com",
          "section": "Tech",
          "feed": "https://lifehacker.com/feed/rss"
        },
        {
          "title": "This 45-Inch LG UltraGear OLED Curved Gaming Monitor Is $700 Off Right Now",
          "link": "https://lifehacker.com/tech/lg-ultragear-oled-curved-gaming-monitor-sale-august-2026?utm_medium=RSS",
          "published": "2026-08-04T19:09:48Z",
          "outlet": "Lifehacker",
          "domain": "lifehacker.com",
          "section": "Tech",
          "feed": "https://lifehacker.com/feed/rss"
        },
        {
          "title": "This 27-Inch Sony OLED Gaming Monitor Is $300 Off Right Now",
          "link": "https://lifehacker.com/tech/sony-inzone-27-inch-oled-gaming-monitor-sale-august-2026?utm_medium=RSS",
          "published": "2026-08-03T21:32:38Z",
          "outlet": "Lifehacker",
          "domain": "lifehacker.com",
          "section": "Tech",
          "feed": "https://lifehacker.com/feed/rss"
        }
      ],
      "days_running": 6,
      "first_seen": "2026-08-03",
      "kind": "deal"
    },
    {
      "id": "st_bfa329",
      "headline": "Israel rejects the 15-point US plan to disarm Hamas",
      "headline_source": "llm",
      "keywords": [
        "rejects",
        "disarm",
        "plan"
      ],
      "entities": [
        "Hamas"
      ],
      "section": "World",
      "outlet_count": 2,
      "article_count": 3,
      "latest_published": "2026-08-09T16:39:14Z",
      "merged_from_groups": 1,
      "outlets": [
        {
          "outlet": "Fox News",
          "domain": "foxnews.com",
          "articles": 2
        },
        {
          "outlet": "NYT",
          "domain": "nytimes.com",
          "articles": 1
        }
      ],
      "articles": [
        {
          "title": "Israel Rejects Trump’s 15-Point Plan to Disarm Hamas",
          "link": "https://www.nytimes.com/2026/08/09/world/middleeast/israel-netanyahu-trump-15-point-plan-hamas-peace-gaza.html",
          "published": "2026-08-09T16:39:14Z",
          "outlet": "NYT",
          "domain": "nytimes.com",
          "section": "General",
          "feed": "https://rss.nytimes.com/services/xml/rss/nyt/HomePage.xml"
        },
        {
          "title": "Netanyahu rejects Board of Peace's Gaza plan: No 'withdrawal until Hamas is genuinely disarmed'",
          "link": "https://www.foxnews.com/world/netanyahu-rejects-board-peace-gaza-plan-no-withdrawal-until-hamas-genuinely-disarmed",
          "published": "2026-08-09T13:14:25Z",
          "outlet": "Fox News",
          "domain": "foxnews.com",
          "section": "World",
          "feed": "https://moxie.foxnews.com/google-publisher/world.xml"
        },
        {
          "title": "Iran reaffirms support for Hamas as Trump pushes to disarm terror group",
          "link": "https://www.foxnews.com/world/iran-reaffirms-support-hamas-trump-pushes-disarm-terror-group",
          "published": "2026-08-03T17:20:54Z",
          "outlet": "Fox News",
          "domain": "foxnews.com",
          "section": "World",
          "feed": "https://moxie.foxnews.com/google-publisher/world.xml"
        }
      ],
      "days_running": 2,
      "first_seen": "2026-08-03",
      "kind": "story"
    },
    {
      "id": "st_999cb0",
      "headline": "My Favorite Earbuds for Sleep Are $60 Off Right Now",
      "headline_source": "fallback",
      "keywords": [
        "60",
        "favorite"
      ],
      "entities": [],
      "section": "Tech",
      "outlet_count": 2,
      "article_count": 3,
      "latest_published": "2026-08-09T11:55:18Z",
      "merged_from_groups": 1,
      "outlets": [
        {
          "outlet": "Lifehacker",
          "domain": "lifehacker.com",
          "articles": 2
        },
        {
          "outlet": "NYT",
          "domain": "nytimes.com",
          "articles": 1
        }
      ],
      "articles": [
        {
          "title": "The Pope’s Favorite Team",
          "link": "https://www.nytimes.com/2026/08/09/briefing/the-popes-favorite-team.html",
          "published": "2026-08-09T11:55:18Z",
          "outlet": "NYT",
          "domain": "nytimes.com",
          "section": "General",